Bedtime Stories ,2008,December,24,2008,"$110,101,975.00 ","$102,772,889.00 ","$212,874,864.00 ",1:39,99,Walt Disney Studios Motion Pictures,"['Adventure', 'Comedy', 'Family', 'Fantasy', 'Romance', 'Sci-Fi']",PG,A hotel handyman's life changes when the lavish bedtime stories he tells his niece and nephew start to magically come true.
Scary Movie 3 ,2003,October,24,2003,"$110,003,217.00 ","$110,670,000.00 ","$220,673,217.00 ",1:24,84,Dimension Films,['Comedy'],PG-13,"Cindy must investigate mysterious crop circles and video tapes, and help the President in preventing an alien invasion."
Creed ,2015,November,25,2015,"$109,767,581.00 ","$63,800,000.00 ","$173,567,581.00 ",2:13,133,Warner Bros.,"['Action', 'Drama', 'Sport']",PG-13,"The former World Heavyweight Champion Rocky Balboa serves as a trainer and mentor to Adonis Johnson, the son of his late friend and former rival Apollo Creed."
Star Trek IV: The Voyage Home ,1986,January,1,1986,"$109,713,132.00 ","$109,713,132.00 ","$109,713,132.00 ",1:59,119,Paramount Pictures,"['Action', 'Adventure', 'Comedy', 'Sci-Fi']",PG-13,"To save Earth from an alien probe, Admiral James T. Kirk and his fugitive crew go back in time to San Francisco in 1986 to retrieve the only beings who can communicate with it: humpback whales."
The 40-Year-Old Virgin ,2005,August,19,2005,"$109,449,237.00 ","$67,929,408.00 ","$177,378,645.00 ",1:56,116,Universal Pictures,"['Comedy', 'Romance']",R,"Goaded by his buddies, a nerdy guy who's never ""done the deed"" only finds the pressure mounting when he meets a single mother."
Couples Retreat ,2009,October,8,2009,"$109,204,945.00 ","$62,639,895.00 ","$171,844,840.00 ",1:53,113,Universal Pictures,['Comedy'],PG-13,"A comedy centered around four couples who settle into a tropical-island resort for a vacation. While one of the couples is there to work on the marriage, the others fail to realize that participation in the resort's therapy sessions is not optional."
A Time to Kill ,1996,January,1,1996,"$108,766,007.00 ","$43,500,000.00 ","$152,266,007.00 ",2:29,149,Warner Bros.,"['Crime', 'Drama', 'Thriller']",PG-13,"In Canton, Mississippi, a fearless young lawyer and his assistant defend a black man accused of murdering two white men who raped his ten-year-old daughter, inciting violent retribution and revenge from the Ku Klux Klan."
Black Hawk Down ,2001,December,28,2001,"$108,638,745.00 ","$64,350,906.00 ","$172,989,651.00 ",2:24,144,Revolution Studios,"['Action', 'Drama', 'History', 'War']",R,"The story of 160 elite U.S. soldiers who dropped into Mogadishu in October 1993 to capture two top lieutenants of a renegade warlord, but found themselves in a desperate battle with a large force of heavily-armed Somalis."
Terms of Endearment ,1983,November,23,1983,"$108,423,489.00 ",$260.00 ,"$108,423,749.00 ",2:12,132,Paramount Pictures,"['Comedy', 'Drama']",PG-13,"Follows hard-to-please Aurora looking for love, and her daughter's family problems."
Ace Ventura: When NULLture Calls ,1995,January,1,1995,"$108,385,533.00 ","$104,000,000.00 ","$212,385,533.00 ",1:30,90,Warner Bros.,"['Adventure', 'Comedy', 'Crime']",PG-13,"Ace Ventura, Pet Detective, returns from a spiritual quest to investigate the disappearance of a rare white bat, the sacred animal of a tribe in Africa."
The Upside ,2017,January,10,2019,"$108,252,517.00 ","$17,603,663.00 ","$125,856,180.00 ",2:06,126,STX Entertainment,"['Comedy', 'Drama']",PG-13,A comedic look at the relationship between a wealthy man with quadriplegia and an unemployed man with a criminal record who's hired to help him.
The Princess Diaries ,2001,August,3,2001,"$108,248,956.00 ","$57,086,197.00 ","$165,335,153.00 ",1:55,115,Walt Disney Studios Motion Pictures,"['Comedy', 'Family', 'Romance']",G,"Mia Thermopolis has just found out that she is the heir apparent to the throne of Genovia. With her friends Lilly and Michael Moscovitz in tow, she tries to navigate through the rest of her sixteenth year."
Superman II ,1980,June,19,1981,"$108,185,706.00 ","$108,185,706.00 ","$108,185,706.00 ",2:07,127,Warner Bros.,"['Action', 'Adventure', 'Sci-Fi']",PG,"Superman agrees to sacrifice his powers to start a relationship with Lois Lane, unaware that three Kryptonian criminals he inadvertently released are conquering Earth."
Little Women ,2019,December,25,2019,"$108,101,214.00 ","$108,500,000.00 ","$216,601,214.00 ",2:15,135,Sony Pictures Entertainment (SPE),"['Drama', 'Romance']",PG,"Jo March reflects back and forth on her life, telling the beloved story of the March sisters - four young women, each determined to live life on her own terms."
Hop ,2011,March,30,2011,"$108,085,305.00 ","$75,868,840.00 ","$183,954,145.00 ",1:35,95,Universal Pictures,"['Adventure', 'Animation', 'Comedy', 'Family', 'Fantasy']",PG,"E.B., the Easter Bunny's teenage son, heads to Hollywood, determined to become a drummer in a rock 'n' roll band. In LA, he's taken in by Fred after the out-of-work slacker hits E.B. with his car."
Pulp Fiction ,1994,October,14,1994,"$107,928,762.00 ","$106,000,000.00 ","$213,928,762.00 ",2:34,154,Miramax,"['Crime', 'Drama']",R,"The lives of two mob hitmen, a boxer, a gangster and his wife, and a pair of diner bandits intertwine in four tales of violence and redemption."
Paranormal Activity ,2007,September,25,2009,"$107,918,810.00 ","$85,436,990.00 ","$193,355,800.00 ",1:26,86,Paramount Pictures,"['Horror', 'Mystery']",R,"After moving into a suburban home, a couple becomes increasingly disturbed by a nightly demonic presence."
Baby Driver ,2017,June,28,2017,"$107,825,862.00 ","$119,119,225.00 ","$226,945,087.00 ",1:53,113,TriStar Pictures,"['Action', 'Crime', 'Drama', 'Music', 'Thriller']",R,"After being coerced into working for a crime boss, a young getaway driver finds himself taking part in a heist doomed to fail."
A League of Their Own ,1992,July,1,1992,"$107,533,928.00 ","$24,906,141.00 ","$132,440,069.00 ",2:08,128,Sony Pictures Entertainment (SPE),"['Comedy', 'Drama', 'Sport']",PG,Two sisters join the first female professional baseball league and struggle to help it succeed amidst their own growing rivalry.
Epic ,2013,May,16,2013,"$107,518,682.00 ","$160,907,952.00 ","$268,426,634.00 ",1:42,102,Twentieth Century Fox,"['Action', 'Adventure', 'Animation', 'Family', 'Fantasy', 'Mystery']",PG,A teenager finds herself transported to a deep forest setting where a battle between the forces of good and the forces of evil is taking place. She bands together with a rag-tag group of characters in order to save their world -- and ours.
Watchmen ,2009,March,4,2009,"$107,509,799.00 ","$77,873,014.00 ","$185,382,813.00 ",2:42,162,Warner Bros.,"['Action', 'Drama', 'Mystery', 'Sci-Fi']",R,"In 1985 where former superheroes exist, the murder of a colleague sends active vigilante Rorschach into his own sprawling investigation, uncovering something that could completely change the course of history as we know it."
The Angry Birds Movie ,2016,May,11,2016,"$107,509,366.00 ","$244,824,563.00 ","$352,333,929.00 ",1:37,97,Sony Pictures Entertainment (SPE),"['Action', 'Adventure', 'Animation', 'Comedy', 'Family']",PG,"When an island populated by happy, flightless birds is visited by mysterious green piggies, it's up to three unlikely outcasts - Red, Chuck and Bomb - to figure out what the pigs are up to."
Batman & Robin ,1997,June,20,1997,"$107,353,792.00 ","$130,881,927.00 ","$238,235,719.00 ",2:05,125,Warner Bros.,"['Action', 'Sci-Fi']",PG-13,Batman and Robin try to keep their relationship together even as they must stop Mr. Freeze and Poison Ivy from freezing Gotham City.
Dune ,2021,January,1,2021,"$107,344,390.00 ","$289,700,000.00 ","$397,044,390.00 ",2:35,155,Warner Bros.,"['Action', 'Adventure', 'Drama', 'Sci-Fi']",PG-13,Feature adaptation of Frank Herbert's science fiction novel about the son of a noble family entrusted with the protection of the most valuable asset and most vital element in the galaxy.
Captain Phillips ,2013,October,11,2013,"$107,100,855.00 ","$111,690,956.00 ","$218,791,811.00 ",2:14,134,Sony Pictures Entertainment (SPE),"['Action', 'Biography', 'Crime', 'Drama', 'Thriller']",PG-13,"The true story of Captain Richard Phillips and the 2009 hijacking by Somali pirates of the U.S.-flagged MV Maersk Alabama, the first American cargo ship to be hijacked in two hundred years."
Black Swan ,2010,December,3,2010,"$106,954,678.00 ","$222,443,368.00 ","$329,398,046.00 ",1:48,108,Fox Searchlight Pictures,"['Drama', 'Thriller']",R,"A committed dancer struggles to maintain her sanity after winning the lead role in a production of Tchaikovsky's ""Swan Lake""."
Analyze This ,1999,March,5,1999,"$106,885,658.00 ","$70,000,000.00 ","$176,885,658.00 ",1:43,103,Warner Bros.,"['Comedy', 'Crime']",R,A comedy about a psychiatrist whose number one patient is an insecure mob boss.
Chicken Run ,2000,June,23,2000,"$106,834,564.00 ","$118,000,000.00 ","$224,834,564.00 ",1:24,84,DreamWorks Distribution,"['Adventure', 'Animation', 'Comedy', 'Drama', 'Family']",PG-13,"When a cockerel apparently flies into a chicken farm, the chickens see him as an opportunity to escape their evil owners."
Miss Congeniality ,2000,December,22,2000,"$106,807,667.00 ","$105,935,053.00 ","$212,742,720.00 ",1:49,109,Warner Bros.,"['Action', 'Comedy', 'Crime', 'Romance']",PG-13,An F.B.I. Agent must go undercover in the Miss United States beauty pageant to prevent a group from bombing the event.
Indecent Proposal ,1993,January,1,1993,"$106,614,059.00 ","$160,000,000.00 ","$266,614,059.00 ",1:57,117,Paramount Pictures,"['Drama', 'Romance']",PG-13,"A billionaire offers $1,000,000 to a young married couple for one night with the wife."
300: Rise of an Empire ,2014,March,5,2014,"$106,580,051.00 ","$231,000,000.00 ","$337,580,051.00 ",1:42,102,Warner Bros.,"['Action', 'Drama']",R,"Greek general Themistokles of Athens leads the naval charge against invading Persian forces led by mortal-turned-god Xerxes and Artemisia, vengeful commander of the Persian navy."
GoldenEye ,1995,January,1,1995,"$106,429,941.00 ","$245,764,093.00 ","$352,194,034.00 ",2:10,130,Metro-Goldwyn-Mayer (MGM),"['Action', 'Adventure', 'Thriller']",PG-13,"Years after a friend and fellow 00 agent is killed on a joint mission, a Russian crime syndicate steals a secret space-based weapons program known as ""GoldenEye"" and James Bond has to stop them from using it."
The Italian Job ,2003,May,30,2003,"$106,128,601.00 ","$69,941,570.00 ","$176,070,171.00 ",1:51,111,Paramount Pictures,"['Action', 'Crime', 'Thriller']",PG-13,"After being betrayed and left for dead in Italy, Charlie Croker and his team plan an elaborate gold heist against their former ally."
How to Lose a Guy in 10 Days ,2003,January,1,2003,"$105,813,373.00 ","$71,689,014.00 ","$177,502,387.00 ",1:56,116,Paramount Pictures,"['Comedy', 'Romance']",PG-13,"Benjamin Barry is an advertising executive and ladies' man who, to win a big campaign, bets that he can make a woman fall in love with him in 10 days."
The Lego Movie 2: The Second Part ,2019,February,6,2019,"$105,806,508.00 ","$86,500,000.00 ","$192,306,508.00 ",1:47,107,Warner Bros.,"['Adventure', 'Animation', 'Comedy', 'Family', 'Fantasy', 'Sci-Fi']",PG,"It's been five years since everything was awesome and the citizens are facing a huge new threat: Lego Duplo invaders from outer space, wrecking everything faster than they can rebuild."
The First Wives Club ,1996,January,1,1996,"$105,489,203.00 ","$76,000,000.00 ","$181,489,203.00 ",1:43,103,Paramount Pictures,['Comedy'],PG-13,"Reunited by the death of a college friend, three divorced women seek revenge on the husbands who left them for younger women."
Robin Hood ,2010,May,12,2010,"$105,269,730.00 ","$216,400,011.00 ","$321,669,741.00 ",2:20,140,Universal Pictures,"['Action', 'Adventure', 'Drama', 'History']",PG-13,"In twelfth-century England, Robin Longstride and his band of marauders confront corruption in a local village and lead an uprising against the crown that will forever alter the balance of world power."
Interview with the Vampire: The Vampire Chronicles ,1994,November,11,1994,"$105,264,608.00 ","$118,400,000.00 ","$223,664,608.00 ",2:03,123,Warner Bros.,"['Drama', 'Fantasy', 'Horror']",R,"A vampire tells his epic life story: love, betrayal, loneliness, and hunger."
George of the Jungle ,1997,July,18,1997,"$105,263,257.00 ","$69,200,000.00 ","$174,463,257.00 ",1:32,92,Walt Disney Studios Motion Pictures,"['Action', 'Adventure', 'Comedy', 'Family', 'Romance']",PG,A man raised in the jungle by apes falls in love with a wealthy American heiress.
Hustlers ,2019,September,12,2019,"$104,963,598.00 ","$52,600,000.00 ","$157,563,598.00 ",1:50,110,STX Entertainment,"['Comedy', 'Crime', 'Drama']",R,"Inspired by the viral New York Magazine article, Hustlers follows a crew of savvy former strip club employees who band together to turn the tables on their Wall Street clients."
Pitch Perfect 3 ,2017,December,21,2017,"$104,897,530.00 ","$80,502,815.00 ","$185,400,345.00 ",1:33,93,Universal Pictures,"['Comedy', 'Music']",PG-13,"Following their win at the world championship, the now separated Bellas reunite for one last singing competition at an overseas USO tour, but face a group who uses both instruments and voices."
Phenomenon ,1996,January,1,1996,"$104,636,382.00 ","$47,400,000.00 ","$152,036,382.00 ",2:03,123,Walt Disney Studios Motion Pictures,"['Drama', 'Fantasy', 'Romance', 'Sci-Fi']",PG-13,"An ordinary man sees a bright light descend from the sky, and discovers he now has super-intelligence and telekinesis."
American Wedding ,2003,August,1,2003,"$104,565,114.00 ","$128,157,821.00 ","$232,722,935.00 ",1:36,96,Universal Pictures,['Comedy'],R,"It's the wedding of Jim and Michelle and the gathering of their families and friends, including Jim's old friends from high school and Michelle's little sister."
Road to Perdition ,2002,July,12,2002,"$104,454,762.00 ","$76,546,716.00 ","$181,001,478.00 ",1:57,117,DreamWorks Distribution,"['Crime', 'Drama', 'Thriller']",R,"A mob enforcer's son in 1930s Illinois witnesses a murder, forcing him and his father to take to the road, and his father down a path of redemption and revenge."
The Princess and the Frog ,2009,November,25,2009,"$104,400,899.00 ","$162,644,866.00 ","$267,045,765.00 ",1:37,97,Walt Disney Studios Motion Pictures,"['Adventure', 'Animation', 'Comedy', 'Family', 'Fantasy', 'Musical', 'Romance']",PG-13,"A waitress, desperate to fulfill her dreams as a restaurant owner, is set on a journey to turn a frog prince back into a human being, but she has to face the same problem after she kisses him."
The Chronicles of Narnia: The Voyage of the Dawn Treader ,2010,December,2,2010,"$104,386,950.00 ","$311,299,267.00 ","$415,686,217.00 ",1:53,113,Twentieth Century Fox,"['Adventure', 'Family', 'Fantasy']",PG,"Lucy and Edmund Pevensie return to Narnia with their cousin Eustace where they meet up with Prince Caspian for a trip across the sea aboard the royal ship The Dawn Treader. Along the way they encounter dragons, dwarves, merfolk, and a band of lost warriors before reaching the edge of the world."
Daddy Day Care ,2003,May,9,2003,"$104,297,061.00 ","$60,136,806.00 ","$164,433,867.00 ",1:32,92,Revolution Studios,"['Comedy', 'Family']",PG,"Two men, Charlie Hinton (Eddie Murphy) and Phil Ryerson (Jeff Garlin), get laid off and have to become stay-at-home dads when they can't find jobs. This inspires them to open their own day-care center."
Daddy's Home 2 ,2017,November,9,2017,"$104,029,443.00 ","$76,584,381.00 ","$180,613,824.00 ",1:40,100,Paramount Pictures,['Comedy'],PG-13,"Having finally gotten used to each other's existence, Brad and Dusty must now deal with their intrusive fathers during the holidays."
Paranormal Activity 3 ,2011,October,19,2011,"$104,028,807.00 ","$103,011,037.00 ","$207,039,844.00 ",1:23,83,Paramount Pictures,"['Horror', 'Mystery']",R,"In 1988, young sisters Katie and Kristi befriend an invisible entity who resides in their home."
Journey 2: The Mysterious Island ,2012,January,19,2012,"$103,860,290.00 ","$231,400,000.00 ","$335,260,290.00 ",1:34,94,Warner Bros.,"['Action', 'Adventure', 'Comedy', 'Family', 'Fantasy', 'Sci-Fi']",PG,"Sean Anderson partners with his mom's husband on a mission to find his grandfather, who is thought to be missing on a mythical island."
The Mule ,2018,December,14,2018,"$103,804,407.00 ","$71,000,000.00 ","$174,804,407.00 ",1:56,116,Warner Bros.,"['Crime', 'Drama', 'Thriller']",R,A ninety-year-old horticulturist and Korean War veteran turns drug mule for a Mexican cartel.
Dick Tracy ,1990,June,15,1990,"$103,738,726.00 ","$59,000,000.00 ","$162,738,726.00 ",1:45,105,Walt Disney Studios Motion Pictures,"['Action', 'Comedy', 'Crime', 'Music', 'Romance', 'Thriller']",PG-13,The comic strip detective finds his life vastly complicated when Breathless Mahoney makes advances towards him while he is trying to battle Big Boy Caprice's united mob.
Rise of the Guardians ,2012,November,21,2012,"$103,412,758.00 ","$203,528,912.00 ","$306,941,670.00 ",1:37,97,DreamWorks,"['Action', 'Adventure', 'Animation', 'Comedy', 'Drama', 'Family', 'Fantasy']",PG,"When the evil spirit Pitch launches an assault on Earth, the Immortal Guardians team up to protect the innocence of children all around the world."
Dreamgirls ,2006,January,1,2006,"$103,365,956.00 ","$52,064,379.00 ","$155,430,335.00 ",2:10,130,DreamWorks,"['Drama', 'Music', 'Musical']",PG-13,"A trio of black female soul singers cross over to the pop charts in the early 1960s, facing their own personal struggles along the way."
Independence Day: Resurgence ,2016,June,22,2016,"$103,144,286.00 ","$286,537,649.00 ","$389,681,935.00 ",2:00,120,Twentieth Century Fox,"['Action', 'Adventure', 'Sci-Fi']",PG-13,"Two decades after the first Independence Day invasion, Earth is faced with a new extra-Solar threat. But will mankind's new space defenses be enough?"
The Expendables ,2010,August,12,2010,"$103,068,524.00 ","$171,401,870.00 ","$274,470,394.00 ",1:43,103,Lionsgate,"['Action', 'Adventure', 'Thriller']",R,A CIA operative hires a team of mercenaries to eliminate a Latin dictator and a renegade CIA agent.
Scream ,1996,December,20,1996,"$103,046,663.00 ","$70,000,000.00 ","$173,046,663.00 ",1:51,111,Dimension Films,"['Horror', 'Mystery']",R,"A year after the murder of her mother, a teenage girl is terrorized by a new killer, who targets the girl and her friends by using horror films as part of a deadly game."
Just Go with It ,2011,February,9,2011,"$103,028,109.00 ","$111,917,482.00 ","$214,945,591.00 ",1:57,117,Sony Pictures Entertainment (SPE),"['Comedy', 'Romance']",PG-13,"On a weekend trip to Hawaii, a plastic surgeon convinces his loyal assistant to pose as his soon-to-be-divorced wife in order to cover up a careless lie he told to his much-younger girlfriend."
Murder on the Orient Express ,2017,November,3,2017,"$102,826,543.00 ","$249,967,538.00 ","$352,794,081.00 ",1:54,114,Twentieth Century Fox,"['Crime', 'Drama', 'Mystery']",PG-13,"When a murder occurs on the train on which he's travelling, celebrated detective Hercule Poirot is recruited to solve the case."
The General's Daughter ,1999,June,18,1999,"$102,705,852.00 ","$47,000,000.00 ","$149,705,852.00 ",1:56,116,Paramount Pictures,"['Crime', 'Drama', 'Mystery', 'Thriller']",R,"When the daughter of a well-known and well-respected base commander is murdered, an undercover detective is summoned to look into the matter and finds a slew of cover-ups at West Point."
The Aviator ,2004,December,17,2004,"$102,610,330.00 ","$111,109,612.00 ","$213,719,942.00 ",2:50,170,Miramax,"['Biography', 'Drama']",PG-13,A biopic depicting the early years of legendary director and aviator Howard Hughes' career from the late 1920s to the mid 1940s.
American Pie ,1999,July,9,1999,"$102,561,004.00 ","$132,922,000.00 ","$235,483,004.00 ",1:35,95,Universal Pictures,['Comedy'],R,Four teenage boys enter a pact to lose their virginity by prom night.
Daredevil ,2003,February,14,2003,"$102,543,518.00 ","$76,636,200.00 ","$179,179,718.00 ",1:43,103,Twentieth Century Fox,"['Action', 'Crime']",PG-13,A man blinded by toxic waste which also enhanced his remaining senses fights crime as an acrobatic martial arts superhero.
The Girl with the Dragon Tattoo ,2011,December,21,2011,"$102,515,793.00 ","$130,101,637.00 ","$232,617,430.00 ",2:38,158,Sony Pictures Entertainment (SPE),"['Crime', 'Drama', 'Mystery', 'Thriller']",R,"Journalist Mikael Blomkvist is aided in his search for a woman who has been missing for forty years by Lisbeth Salander, a young computer hacker."
The Mummy: Tomb of the Dragon Emperor ,2008,July,30,2008,"$102,491,776.00 ","$300,958,054.00 ","$403,449,830.00 ",1:52,112,Universal Pictures,"['Action', 'Fantasy', 'Horror', 'War']",PG-13,"In the Far East, Alex O'Connell, the son of famed mummy fighters Rick and Evy O'Connell, unearths the mummy of the first Emperor of Qin -- a shape-shifting entity cursed by a witch centuries ago."
The Conjuring 2 ,2016,June,8,2016,"$102,470,008.00 ","$219,318,211.00 ","$321,788,219.00 ",2:14,134,Warner Bros.,"['Horror', 'Mystery', 'Thriller']",R,Ed and Lorraine Warren travel to North London to help a single mother raising four children alone in a house plagued by a supernatural spirit.
The Maze Runner ,2014,September,11,2014,"$102,427,862.00 ","$245,891,999.00 ","$348,319,861.00 ",1:53,113,Twentieth Century Fox,"['Action', 'Mystery', 'Sci-Fi', 'Thriller']",PG-13,"Thomas is deposited in a community of boys after his memory is erased, soon learning they're all trapped in a maze that will require him to join forces with fellow ""runners"" for a shot at escape."
In the Line of Fire ,1993,July,9,1993,"$102,314,823.00 ","$74,682,345.00 ","$176,997,168.00 ",2:08,128,Columbia Pictures,"['Action', 'Crime', 'Drama', 'Thriller']",R,"Secret Service agent Frank Horrigan (Clint Eastwood) couldn't save Kennedy, but he's determined not to let a clever assassin take out this president."
Annabelle: Creation ,2017,August,3,2017,"$102,092,201.00 ","$204,423,683.00 ","$306,515,884.00 ",1:49,109,Warner Bros.,"['Horror', 'Mystery', 'Thriller']",R,"Twelve years after the tragic death of their little girl, a doll-maker and his wife welcome a nun and several girls from a shuttered orphanage into their home, where they become the target of the doll-maker's possessed creation, Annabelle."
The Equalizer 2 ,2018,July,18,2018,"$102,084,362.00 ","$88,315,795.00 ","$190,400,157.00 ",2:01,121,Sony Pictures Entertainment (SPE),"['Action', 'Crime', 'Thriller']",R,"Robert McCall serves an unflinching justice for the exploited and oppressed, but how far will he go when that is someone he loves?"
Bad Grandpa ,2013,October,23,2013,"$102,003,019.00 ","$49,823,528.00 ","$151,826,547.00 ",1:32,92,Paramount Pictures,['Comedy'],R,"86-year-old Irving Zisman takes a trip from Nebraska to North Carolina to take his 8 year-old grandson, Billy, back to his real father."
Pacific Rim ,2013,July,11,2013,"$101,802,906.00 ","$309,200,000.00 ","$411,002,906.00 ",2:11,131,Warner Bros.,"['Action', 'Adventure', 'Sci-Fi']",PG-13,"As a war between humankind and monstrous sea creatures wages on, a former pilot and a trainee are paired up to drive a seemingly obsolete special weapon in a desperate effort to save the world from the apocalypse."
Journey to the Center of the Earth ,2008,July,10,2008,"$101,704,370.00 ","$142,528,318.00 ","$244,232,688.00 ",1:33,93,Warner Bros.,"['Action', 'Adventure', 'Family', 'Fantasy', 'Sci-Fi']",PG,"On a quest to find out what happened to his missing brother, a scientist, his nephew and their mountain guide discover a fantastic and dangerous lost world in the center of the earth."
Gone in 60 Seconds ,2000,June,9,2000,"$101,648,571.00 ","$135,553,728.00 ","$237,202,299.00 ",1:58,118,Walt Disney Studios Motion Pictures,"['Action', 'Crime', 'Thriller']",PG-13,A retired master car thief must come back to the industry and steal fifty cars with his crew in one night to save his brother's life.
Maverick ,1994,January,1,1994,"$101,631,272.00 ","$81,400,000.00 ","$183,031,272.00 ",2:07,127,Warner Bros.,"['Action', 'Adventure', 'Comedy', 'Thriller', 'Western']",PG-13,"Bret Maverick, needing money for a poker tournament, faces various comic mishaps and challenges, including a charming woman thief."
Sleeping with the Enemy ,1991,February,8,1991,"$101,599,005.00 ","$73,400,000.00 ","$174,999,005.00 ",1:39,99,Twentieth Century Fox,"['Drama', 'Thriller']",R,"A young woman fakes her own death in an attempt to escape her nightmarish marriage, but discovers it is impossible to elude her controlling husband."
The Equalizer ,2014,September,24,2014,"$101,530,738.00 ","$90,800,000.00 ","$192,330,738.00 ",2:12,132,Sony Pictures Entertainment (SPE),"['Action', 'Crime', 'Thriller']",R,A man who believes he has put his mysterious past behind him cannot stand idly by when he meets a young girl under the control of ultra-violent Russian gangsters.
This Is the End ,2013,June,12,2013,"$101,470,202.00 ","$24,571,120.00 ","$126,041,322.00 ",1:47,107,Sony Pictures Entertainment (SPE),['Comedy'],R,"Six Los Angeles celebrities are stuck in James Franco's house after a series of devastating events just destroyed the city. Inside, the group not only have to face the apocalypse, but themselves."
Eagle Eye ,2008,September,25,2008,"$101,440,743.00 ","$77,326,640.00 ","$178,767,383.00 ",1:58,118,DreamWorks,"['Action', 'Mystery', 'Thriller']",PG-13,"Jerry and Rachel are two strangers thrown together by a mysterious phone call from a woman they have never met. Threatening their lives and family, she pushes Jerry and Rachel into a series of increasingly dangerous situations, using the technology of everyday life to track and control their every move."
