Movie Title,Movie Year,Release Month,Release Date,Release Year,Domestic Sales (in $),International Sales (in $),World Sales (in $),Movie Runtime,Movie Runtime (Total Minutes),Distributor,Genre,License,Movie Info
Star Wars: Episode VII - The Force Awakens ,2015,January,1,2015,"$936,662,225.00 ","$1,132,859,475.00 ","$2,069,521,700.00 ",2:18,138,Walt Disney Studios Motion Pictures,"['Action', 'Adventure', 'Sci-Fi']",PG-13,"As a new threat to the galaxy rises, Rey, a desert scavenger, and Finn, an ex-stormtrooper, must join Han Solo and Chewbacca to search for the one hope of restoring peace."
Avengers: Endgame ,2019,April,24,2019,"$858,373,000.00 ","$1,939,128,328.00 ","$2,797,501,328.00 ",3:01,181,Walt Disney Studios Motion Pictures,"['Action', 'Adventure', 'Drama', 'Sci-Fi']",PG-13,"After the devastating events of Avengers: Infinity War, the universe is in ruins. With the help of remaining allies, the Avengers assemble once more in order to reverse Thanos' actions and restore balance to the universe."
Avatar ,2009,December,16,2009,"$760,507,625.00 ","$2,086,738,578.00 ","$2,847,246,203.00 ",2:42,162,Twentieth Century Fox,"['Action', 'Adventure', 'Fantasy', 'Sci-Fi']",PG-13,A paraplegic Marine dispatched to the moon Pandora on a unique mission becomes torn between following his orders and protecting the world he feels is his home.
Black Panther ,2018,January,1,2018,"$700,426,566.00 ","$647,171,407.00 ","$1,347,597,973.00 ",2:14,134,Walt Disney Studios Motion Pictures,"['Action', 'Adventure', 'Sci-Fi']",PG-13,2018
Avengers: Infinity War ,2018,January,1,2018,"$678,815,482.00 ","$1,369,544,272.00 ","$2,048,359,754.00 ",2:29,149,Walt Disney Studios Motion Pictures,"['Action', 'Adventure', 'Sci-Fi']",PG-13,The Avengers and their allies must be willing to sacrifice all in an attempt to defeat the powerful Thanos before his blitz of devastation and ruin puts an end to the universe.
Spider-Man: No Way Home ,2018,January,1,2018,"$675,813,257.00 ","$868,642,706.00 ","$1,544,455,963.00 ",2:28,148,Sony Pictures Entertainment (SPE),"['Action', 'Adventure', 'Fantasy', 'Sci-Fi']",PG-13,"With Spider-Man's identity now revealed, Peter asks Doctor Strange for help. When a spell goes wrong, dangerous foes from other worlds start to appear, forcing Peter to discover what it truly means to be Spider-Man."
Titanic ,1997,December,19,1997,"$659,363,944.00 ","$1,542,283,320.00 ","$2,201,647,264.00 ",3:14,194,Paramount Pictures,"['Drama', 'Romance']",PG-13,"A seventeen-year-old aristocrat falls in love with a kind but poor artist aboard the luxurious, ill-fated R.M.S. Titanic."
Jurassic World ,2015,June,10,2015,"$652,385,625.00 ","$1,018,130,819.00 ","$1,670,516,444.00 ",2:04,124,Universal Pictures,"['Action', 'Adventure', 'Sci-Fi']",PG-13,"A new theme park, built on the original site of Jurassic Park, creates a genetically modified hybrid dinosaur, the Indominus Rex, which escapes containment and goes on a killing spree."
The Avengers ,2012,April,25,2012,"$623,357,910.00 ","$895,457,605.00 ","$1,518,815,515.00 ",2:23,143,Walt Disney Studios Motion Pictures,"['Action', 'Adventure', 'Sci-Fi']",PG-13,Earth's mightiest heroes must come together and learn to fight as a team if they are going to stop the mischievous Loki and his alien army from enslaving humanity.
Star Wars: Episode VIII - The Last Jedi ,2017,December,13,2017,"$620,181,382.00 ","$712,517,448.00 ","$1,332,698,830.00 ",2:32,152,Walt Disney Studios Motion Pictures,"['Action', 'Adventure', 'Fantasy', 'Sci-Fi']",PG-13,"The Star Wars saga continues as new heroes and galactic legends go on an epic adventure, unlocking mysteries of the Force and shocking revelations of the past."
Incredibles 2 ,2018,January,1,2018,"$608,581,744.00 ","$634,507,500.00 ","$1,243,089,244.00 ",1:58,118,Walt Disney Studios Motion Pictures,"['Action', 'Adventure', 'Animation', 'Comedy', 'Family', 'Sci-Fi']",PG-13,The Incredibles family takes on a new mission which involves a change in family roles: Bob Parr (Mr. Incredible) must manage the house while his wife Helen (Elastigirl) goes out to save the world.
The Lion King ,2019,July,11,2019,"$543,638,043.00 ","$1,119,261,396.00 ","$1,662,899,439.00 ",1:58,118,Walt Disney Studios Motion Pictures,"['Adventure', 'Animation', 'Drama', 'Family', 'Musical']",PG,"After the murder of his father, a young lion prince flees his kingdom only to learn the true meaning of responsibility and bravery."
The Dark Knight ,2008,July,16,2008,"$534,858,444.00 ","$471,115,201.00 ","$1,005,973,645.00 ",2:32,152,Warner Bros.,"['Action', 'Crime', 'Drama', 'Thriller']",PG-13,"When the menace known as the Joker wreaks havoc and chaos on the people of Gotham, Batman must accept one of the greatest psychological and physical tests of his ability to fight injustice."
Rogue One: A Star Wars Story ,2016,December,14,2016,"$532,177,324.00 ","$523,880,396.00 ","$1,056,057,720.00 ",2:13,133,Walt Disney Studios Motion Pictures,"['Action', 'Adventure', 'Sci-Fi']",PG-13,"In a time of conflict, a group of unlikely heroes band together on a mission to steal the plans to the Death Star, the Empire's ultimate weapon of destruction."
Star Wars: Episode IX - The Rise of Skywalker ,2019,December,18,2019,"$515,202,542.00 ","$558,946,737.00 ","$1,074,149,279.00 ",2:21,141,Walt Disney Studios Motion Pictures,"['Action', 'Adventure', 'Fantasy', 'Sci-Fi']",PG-13,"In the riveting conclusion of the landmark Skywalker saga, new legends will be born-and the final battle for freedom is yet to come."
Beauty and the Beast ,2017,March,16,2017,"$504,481,165.00 ","$769,095,055.00 ","$1,273,576,220.00 ",2:09,129,Walt Disney Studios Motion Pictures,"['Adventure', 'Family', 'Fantasy', 'Musical', 'Romance']",PG,"A selfish Prince is cursed to become a monster for the rest of his life, unless he learns to fall in love with a beautiful young woman he keeps prisoner."
Finding Dory ,2018,January,1,2018,"$486,295,561.00 ","$542,275,381.00 ","$1,028,570,942.00 ",1:37,97,Walt Disney Studios Motion Pictures,"['Adventure', 'Animation', 'Comedy', 'Family']",PG-13,"Friendly but forgetful blue tang Dory begins a search for her long-lost parents, and everyone learns a few things about the real meaning of family along the way."
Frozen II ,2019,November,20,2019,"$477,373,578.00 ","$972,653,355.00 ","$1,450,026,933.00 ",1:43,103,Walt Disney Studios Motion Pictures,"['Adventure', 'Animation', 'Comedy', 'Family', 'Fantasy', 'Musical']",PG,"Anna, Elsa, Kristoff, Olaf and Sven leave Arendelle to travel to an ancient, autumn-bound forest of an enchanted land. They set out to find the origin of Elsa's powers in order to save their kingdom."
Star Wars: Episode I - The Phantom Menace ,1999,May,19,1999,"$474,544,677.00 ","$552,538,030.00 ","$1,027,082,707.00 ",2:16,136,Twentieth Century Fox,"['Action', 'Adventure', 'Fantasy', 'Sci-Fi']",PG,"Two Jedi escape a hostile blockade to find allies and come across a young boy who may bring balance to the Force, but the long dormant Sith resurface to claim their original glory."
Star Wars: Episode IV - A New Hope ,1977,May,25,1977,"$460,998,507.00 ","$195,751,992.00 ","$775,398,007.00 ",2:01,121,Twentieth Century Fox,"['Action', 'Adventure', 'Fantasy', 'Sci-Fi']",PG,"Luke Skywalker joins forces with a Jedi Knight, a cocky pilot, a Wookiee and two droids to save the galaxy from the Empire's world-destroying battle station, while also attempting to rescue Princess Leia from the mysterious Darth Vader."
Avengers: Age of Ultron ,2015,April,22,2015,"$459,005,868.00 ","$943,803,672.00 ","$1,402,809,540.00 ",2:21,141,Walt Disney Studios Motion Pictures,"['Action', 'Adventure', 'Sci-Fi']",PG-13,"When Tony Stark and Bruce Banner try to jump-start a dormant peacekeeping program called Ultron, things go horribly wrong and it's up to Earth's mightiest heroes to stop the villainous Ultron from enacting his terrible plan."
The Dark Knight Rises ,2012,July,19,2012,"$448,139,099.00 ","$633,003,513.00 ","$1,081,142,612.00 ",2:44,164,Warner Bros.,"['Action', 'Crime', 'Drama']",PG-13,"Eight years after the Joker's reign of anarchy, Batman, with the help of the enigmatic Catwoman, is forced from his exile to save Gotham City from the brutal guerrilla terrorist Bane."
Shrek 2 ,2004,May,19,2004,"$441,226,247.00 ","$487,534,523.00 ","$928,760,770.00 ",1:33,93,DreamWorks Distribution,"['Adventure', 'Animation', 'Comedy', 'Family', 'Fantasy', 'Romance']",PG,"Shrek and Fiona travel to the Kingdom of Far Far Away, where Fiona's parents are King and Queen, to celebrate their marriage. When they arrive, they find they are not as welcome as they thought they would be."
E.T. the Extra-Terrestrial ,1982,June,11,1982,"$435,110,554.00 ","$304,203,888.00 ","$792,910,554.00 ",1:55,115,Universal Pictures,"['Adventure', 'Family', 'Sci-Fi']",PG,A troubled child summons the courage to help a friendly alien escape Earth and return to his home world.
Toy Story 4 ,2019,June,20,2019,"$434,038,008.00 ","$639,356,585.00 ","$1,073,394,593.00 ",1:40,100,Walt Disney Studios Motion Pictures,"['Adventure', 'Animation', 'Comedy', 'Family', 'Fantasy']",G,"When a new toy called ""Forky"" joins Woody and the gang, a road trip alongside old and new friends reveals how big the world can be for a toy."
Captain Marvel ,2019,March,6,2019,"$426,829,839.00 ","$701,633,133.00 ","$1,128,462,972.00 ",2:03,123,Walt Disney Studios Motion Pictures,"['Action', 'Adventure', 'Sci-Fi']",PG-13,Carol Danvers becomes one of the universe's most powerful heroes when Earth is caught in the middle of a galactic war between two alien races.
The Hunger Games: Catching Fire ,2013,November,15,2013,"$424,668,047.00 ","$440,343,699.00 ","$865,011,746.00 ",2:26,146,Lionsgate,"['Action', 'Adventure', 'Drama', 'Sci-Fi', 'Thriller']",PG-13,Katniss Everdeen and Peeta Mellark become targets of the Capitol after their victory in the 74th Hunger Games sparks a rebellion in the Districts of Panem.
Pirates of the Caribbean: Dead Man's Chest ,2006,July,6,2006,"$423,315,812.00 ","$642,863,935.00 ","$1,066,179,747.00 ",2:31,151,Walt Disney Studios Motion Pictures,"['Action', 'Adventure', 'Fantasy']",PG-13,"Jack Sparrow races to recover the heart of Davy Jones to avoid enslaving his soul to Jones' service, as other friends and foes seek the heart for their own agenda as well."
The Lion King ,1994,June,15,1994,"$422,783,777.00 ","$640,828,028.00 ","$1,063,611,805.00 ",1:28,88,Walt Disney Studios Motion Pictures,"['Adventure', 'Animation', 'Drama', 'Family', 'Musical']",G,"Lion prince Simba and his father are targeted by his bitter uncle, who wants to ascend the throne himself."
Jurassic World: Fallen Kingdom ,2018,June,6,2018,"$417,719,760.00 ","$892,746,536.00 ","$1,310,466,296.00 ",2:08,128,Universal Pictures,"['Action', 'Adventure', 'Sci-Fi']",PG-13,"When the island's dormant volcano begins roaring to life, Owen and Claire mount a campaign to rescue the remaining dinosaurs from this extinction-level event."
Toy Story 3 ,2010,June,16,2010,"$415,004,880.00 ","$651,965,931.00 ","$1,066,970,811.00 ",1:43,103,Walt Disney Studios Motion Pictures,"['Adventure', 'Animation', 'Comedy', 'Family', 'Fantasy']",PG-13,"The toys are mistakenly delivered to a day-care center instead of the attic right before Andy leaves for college, and it's up to Woody to convince the other toys that they weren't abandoned and to return home."
Wonder Woman ,2017,May,30,2017,"$412,815,408.00 ","$410,009,114.00 ","$822,824,522.00 ",2:21,141,Warner Bros.,"['Action', 'Adventure', 'Fantasy', 'Sci-Fi', 'War']",PG-13,"When a pilot crashes and tells of conflict in the outside world, Diana, an Amazonian warrior in training, leaves home to fight a war, discovering her full powers and true destiny."
Iron Man 3 ,2013,April,24,2013,"$409,013,994.00 ","$805,797,258.00 ","$1,214,811,252.00 ",2:10,130,Walt Disney Studios Motion Pictures,"['Action', 'Adventure', 'Sci-Fi']",PG-13,"When Tony Stark's world is torn apart by a formidable terrorist called the Mandarin, he starts an odyssey of rebuilding and retribution."
Captain America: Civil War ,2016,April,27,2016,"$408,084,349.00 ","$745,253,147.00 ","$1,153,337,496.00 ",2:27,147,Walt Disney Studios Motion Pictures,"['Action', 'Adventure', 'Sci-Fi']",PG-13,Political involvement in the Avengers' affairs causes a rift between Captain America and Iron Man.
The Hunger Games ,2012,March,8,2012,"$408,010,692.00 ","$286,384,032.00 ","$694,394,724.00 ",2:22,142,Lionsgate,"['Action', 'Adventure', 'Sci-Fi', 'Thriller']",PG-13,Katniss Everdeen voluntarily takes her younger sister's place in the Hunger Games: a televised competition in which two teenagers from each of the twelve Districts of Panem are chosen at random to fight to the death.
Spider-Man ,2002,May,3,2002,"$407,022,860.00 ","$418,002,176.00 ","$825,025,036.00 ",2:01,121,Sony Pictures Entertainment (SPE),"['Action', 'Adventure', 'Sci-Fi']",PG-13,"When bitten by a genetically modified spider, a nerdy, shy, and awkward high school student gains spider-like abilities that he eventually must use to fight evil as a superhero after tragedy befalls his family."
Jumanji: Welcome to the Jungle ,2017,December,20,2017,"$404,540,171.00 ","$558,002,774.00 ","$962,542,945.00 ",1:59,119,Sony Pictures Entertainment (SPE),"['Action', 'Adventure', 'Comedy', 'Fantasy']",PG-13,"Four teenagers are sucked into a magical video game, and the only way they can escape is to work together to finish the game."
Jurassic Park ,1993,June,11,1993,"$404,214,720.00 ","$629,713,583.00 ","$1,033,928,303.00 ",2:07,127,Universal Pictures,"['Action', 'Adventure', 'Sci-Fi', 'Thriller']",PG-13,A pragmatic paleontologist touring an almost complete theme park on an island in Central America is tasked with protecting a couple of kids after a power failure causes the park's cloned dinosaurs to run loose.
Transformers: Revenge of the Fallen ,2009,June,19,2009,"$402,111,870.00 ","$434,191,823.00 ","$836,303,693.00 ",2:29,149,DreamWorks,"['Action', 'Adventure', 'Sci-Fi']",PG-13,"Sam Witwicky leaves the Autobots behind for a normal life. But when his mind is filled with cryptic symbols, the Decepticons target him and he is dragged back into the Transformers' war."
Frozen ,2013,November,22,2013,"$400,953,009.00 ","$880,555,091.00 ","$1,281,508,100.00 ",1:42,102,Walt Disney Studios Motion Pictures,"['Adventure', 'Animation', 'Comedy', 'Family', 'Fantasy', 'Musical']",PG,"When the newly crowned Queen Elsa accidentally uses her power to turn things into ice to curse her home in infinite winter, her sister Anna teams up with a mountain man, his playful reindeer, and a snowman to change the weather condition."
Spider-Man: Far from Home ,2019,June,28,2019,"$390,532,085.00 ","$741,395,911.00 ","$1,131,927,996.00 ",2:09,129,Sony Pictures Entertainment (SPE),"['Action', 'Adventure', 'Sci-Fi']",PG-13,"Following the events of Avengers: Endgame, Spider-Man must step up to take on new threats in a world that has changed forever."
Guardians of the Galaxy Vol. 2 ,2017,April,25,2017,"$389,813,101.00 ","$473,942,950.00 ","$863,756,051.00 ",2:16,136,Walt Disney Studios Motion Pictures,"['Action', 'Adventure', 'Comedy', 'Sci-Fi']",PG-13,"The Guardians struggle to keep together as a team while dealing with their personal family issues, notably Star-Lord's encounter with his father the ambitious celestial being Ego."
Harry Potter and the Deathly Hallows: Part 2 ,2018,January,1,2018,"$381,409,310.00 ","$960,912,354.00 ","$1,342,321,665.00 ",2:10,130,Warner Bros.,"['Adventure', 'Fantasy', 'Mystery']",PG-13,"Harry, Ron, and Hermione search for Voldemort's remaining Horcruxes in their effort to destroy the Dark Lord as the final battle rages on at Hogwarts."
Finding Nemo ,2003,May,30,2003,"$380,843,261.00 ","$559,509,384.00 ","$940,352,645.00 ",1:40,100,Walt Disney Studios Motion Pictures,"['Adventure', 'Animation', 'Comedy', 'Family']",PG-13,"After his son is captured in the Great Barrier Reef and taken to Sydney, a timid clownfish sets out on a journey to bring him home."
Star Wars: Episode III - Revenge of the Sith ,2005,May,18,2005,"$380,270,577.00 ","$488,119,983.00 ","$868,390,560.00 ",2:20,140,Twentieth Century Fox,"['Action', 'Adventure', 'Fantasy', 'Sci-Fi']",PG-13,"Three years into the Clone Wars, the Jedi rescue Palpatine from Count Dooku. As Obi-Wan pursues a new threat, Anakin acts as a double agent between the Jedi Council and Palpatine and is lured into a sinister plan to rule the galaxy."
The Lord of the Rings: The Return of the King ,2003,December,17,2003,"$377,845,905.00 ","$768,185,007.00 ","$1,146,030,912.00 ",3:21,201,New Line Cinema,"['Action', 'Adventure', 'Drama', 'Fantasy']",PG-13,Gandalf and Aragorn lead the World of Men against Sauron's army to draw his gaze from Frodo and Sam as they approach Mount Doom with the One Ring.
Spider-Man 2 ,2004,June,30,2004,"$373,585,825.00 ","$415,390,628.00 ","$788,976,453.00 ",2:07,127,Sony Pictures Entertainment (SPE),"['Action', 'Adventure', 'Sci-Fi']",PG-13,Peter Parker is beset with troubles in his failing personal life as he battles a brilliant scientist named Doctor Otto Octavius.
The Passion of the Christ ,2004,February,25,2004,"$370,782,930.00 ","$241,271,576.00 ","$612,054,506.00 ",2:07,127,Newmarket Films,['Drama'],R,"Depicts the final twelve hours in the life of Jesus of Nazareth, on the day of his crucifixion in Jerusalem."
The Secret Life of Pets ,2016,June,24,2016,"$368,384,330.00 ","$507,074,301.00 ","$875,458,631.00 ",1:27,87,Universal Pictures,"['Adventure', 'Animation', 'Comedy', 'Family']",PG,"The quiet life of a terrier named Max is upended when his owner takes in Duke, a stray whom Max instantly dislikes."
Despicable Me 2 ,2013,June,20,2013,"$368,065,385.00 ","$602,700,620.00 ","$970,766,005.00 ",1:38,98,Universal Pictures,"['Adventure', 'Animation', 'Comedy', 'Crime', 'Family', 'Sci-Fi']",PG,"When Gru, the world's most super-bad turned super-dad has been recruited by a team of officials to stop lethal muscle and a host of Gru's own, He has to fight back with new gadgetry, cars, and more minion madness."
The Jungle Book ,2016,April,7,2016,"$364,001,123.00 ","$602,553,806.00 ","$966,554,929.00 ",1:46,106,Walt Disney Studios Motion Pictures,"['Adventure', 'Drama', 'Family', 'Fantasy']",PG,"After a threat from the tiger Shere Khan forces him to flee the jungle, a man-cub named Mowgli embarks on a journey of self discovery with the help of panther Bagheera and free-spirited bear Baloo."
Deadpool ,2016,February,9,2016,"$363,070,709.00 ","$419,766,082.00 ","$782,836,791.00 ",1:48,108,Twentieth Century Fox,"['Action', 'Adventure', 'Comedy', 'Sci-Fi']",R,"A wisecracking mercenary gets experimented on and becomes immortal but ugly, and sets out to track down the man who ruined his looks."
Inside Out ,2015,June,10,2015,"$356,921,711.00 ","$501,926,308.00 ","$858,848,019.00 ",1:35,95,Walt Disney Studios Motion Pictures,"['Adventure', 'Animation', 'Comedy', 'Drama', 'Family', 'Fantasy', 'Sci-Fi']",PG,"After young Riley is uprooted from her Midwest life and moved to San Francisco, her emotions - Joy, Fear, Anger, Disgust and Sadness - conflict on how best to navigate a new city, house, and school."
Aladdin ,2019,May,22,2019,"$355,559,216.00 ","$695,134,737.00 ","$1,050,693,953.00 ",2:08,128,Walt Disney Studios Motion Pictures,"['Adventure', 'Comedy', 'Family', 'Fantasy', 'Musical', 'Romance']",PG,A kind-hearted street urchin and a power-hungry Grand Vizier vie for a magic lamp that has the power to make their deepest wishes come true.
Furious 7 ,2015,April,1,2015,"$353,007,020.00 ","$1,162,334,379.00 ","$1,515,341,399.00 ",2:17,137,Universal Pictures,"['Action', 'Thriller']",PG-13,Deckard Shaw seeks revenge against Dominic Toretto and his family for his comatose brother.
Transformers: Dark of the Moon ,2011,June,29,2011,"$352,390,543.00 ","$771,403,536.00 ","$1,123,794,079.00 ",2:34,154,DreamWorks,"['Action', 'Adventure', 'Sci-Fi']",PG-13,"The Autobots learn of a Cybertronian spacecraft hidden on the moon, and race against the Decepticons to reach it and to learn its secrets."
American Sniper ,2014,December,25,2014,"$350,126,372.00 ","$197,300,000.00 ","$547,426,372.00 ",2:13,133,Warner Bros.,"['Action', 'Biography', 'Drama', 'War']",R,"Navy S.E.A.L. sniper Chris Kyle's pinpoint accuracy saves countless lives on the battlefield and turns him into a legend. Back home with his family after four tours of duty, however, Chris finds that it is the war he can't leave behind."
The Lord of the Rings: The Two Towers ,2002,December,18,2002,"$342,551,365.00 ","$604,943,730.00 ","$947,495,095.00 ",2:59,179,New Line Cinema,"['Action', 'Adventure', 'Drama', 'Fantasy']",PG,"While Frodo and Sam edge closer to Mordor with the help of the shifty Gollum, the divided fellowship makes a stand against Sauron's new ally, Saruman, and his hordes of Isengard."
Zootopia ,2018,January,1,2018,"$341,268,248.00 ","$682,852,856.00 ","$1,024,121,104.00 ",1:48,108,Walt Disney Studios Motion Pictures,"['Adventure', 'Animation', 'Comedy', 'Crime', 'Family', 'Mystery']",PG-13,"In a city of anthropomorphic animals, a rookie bunny cop and a cynical con artist fox must work together to uncover a conspiracy."
The Hunger Games: Mockingjay - Part 1 ,2014,November,19,2014,"$337,135,885.00 ","$418,220,826.00 ","$755,356,711.00 ",2:03,123,Lionsgate,"['Action', 'Adventure', 'Sci-Fi', 'Thriller']",PG-13,"Katniss Everdeen is in District 13 after she shatters the games forever. Under the leadership of President Coin and the advice of her trusted friends, Katniss spreads her wings as she fights to save Peeta and a nation moved by her courage."
Spider-Man 3 ,2007,May,1,2007,"$336,530,303.00 ","$558,453,070.00 ","$894,983,373.00 ",2:19,139,Sony Pictures Entertainment (SPE),"['Action', 'Adventure', 'Sci-Fi']",PG-13,"A strange black entity from another world bonds with Peter Parker and causes inner turmoil as he contends with new villains, temptations, and revenge."
Minions ,2015,April,9,2015,"$336,045,770.00 ","$823,398,892.00 ","$1,159,444,662.00 ",1:31,91,Universal Pictures,"['Adventure', 'Animation', 'Comedy', 'Crime', 'Family', 'Sci-Fi']",PG,"Minions Stuart, Kevin, and Bob are recruited by Scarlet Overkill, a supervillain who, alongside her inventor husband Herb, hatches a plot to take over the world."
Joker ,2019,October,2,2019,"$335,451,311.00 ","$738,968,073.00 ","$1,074,419,384.00 ",2:02,122,Warner Bros.,"['Crime', 'Drama', 'Thriller']",R,"In Gotham City, mentally troubled comedian Arthur Fleck is disregarded and mistreated by society. He then embarks on a downward spiral of revolution and bloody crime. This path brings him face-to-face with his alter-ego: the Joker."
Aquaman ,2018,January,1,2018,"$335,061,807.00 ","$813,424,079.00 ","$1,148,485,886.00 ",2:23,143,Warner Bros.,"['Action', 'Adventure', 'Fantasy', 'Sci-Fi']",PG-13,"Arthur Curry, the human-born heir to the underwater kingdom of Atlantis, goes on a quest to prevent a war between the worlds of ocean and land."
Spider-Man: Homecoming ,2017,July,5,2017,"$334,201,140.00 ","$545,965,784.00 ","$880,166,924.00 ",2:13,133,Sony Pictures Entertainment (SPE),"['Action', 'Adventure', 'Sci-Fi']",PG-13,"Peter Parker balances his life as an ordinary high school student in Queens with his superhero alter-ego Spider-Man, and finds himself on the trail of a new menace prowling the skies of New York City."
Alice in Wonderland ,2010,March,3,2010,"$334,191,110.00 ","$691,277,106.00 ","$1,025,468,216.00 ",1:48,108,Walt Disney Studios Motion Pictures,"['Adventure', 'Family', 'Fantasy', 'Mystery']",PG,"Nineteen-year-old Alice returns to the magical world from her childhood adventure, where she reunites with her old friends and learns of her true destiny: to end the Red Queen's reign of terror."
Guardians of the Galaxy ,2014,July,30,2014,"$333,718,600.00 ","$439,631,547.00 ","$773,350,147.00 ",2:01,121,Walt Disney Studios Motion Pictures,"['Action', 'Adventure', 'Comedy', 'Sci-Fi']",PG-13,A group of intergalactic criminals must pull together to stop a fanatical warrior with plans to purge the universe.
Forrest Gump ,1994,July,6,1994,"$330,455,270.00 ","$347,770,863.00 ","$678,226,133.00 ",2:22,142,Paramount Pictures,"['Drama', 'Romance']",PG-13,"The presidencies of Kennedy and Johnson, the Vietnam War, the Watergate scandal and other historical events unfold from the perspective of an Alabama man with an IQ of 75, whose only desire is to be reunited with his childhood sweetheart."
Batman v Superman: Dawn of Justice ,2016,March,23,2016,"$330,360,194.00 ","$543,277,334.00 ","$873,637,528.00 ",2:32,152,Warner Bros.,"['Action', 'Adventure', 'Sci-Fi']",PG-13,"Fearing that the actions of Superman are left unchecked, Batman takes on the Man of Steel, while the world wrestles with what kind of a hero it really needs."
It ,2017,September,6,2017,"$328,828,874.00 ","$372,967,570.00 ","$701,796,444.00 ",2:15,135,Warner Bros.,['Horror'],R,"In the summer of 1989, a group of bullied kids band together to destroy a shape-shifting monster, which disguises itself as a clown and preys on the children of Derry, their small Maine town."
Suicide Squad ,2016,August,3,2016,"$325,100,054.00 ","$421,746,840.00 ","$746,846,894.00 ",2:03,123,Warner Bros.,"['Action', 'Adventure', 'Fantasy', 'Sci-Fi']",PG-13,A secret government agency recruits some of the most dangerous incarcerated super-villains to form a defensive task force. Their first mission: save the world from the apocalypse.
Deadpool 2 ,2018,May,16,2018,"$324,591,735.00 ","$461,304,874.00 ","$785,896,609.00 ",1:59,119,Twentieth Century Fox,"['Action', 'Adventure', 'Comedy', 'Sci-Fi']",R,"Foul-mouthed mutant mercenary Wade Wilson (a.k.a. Deadpool) assembles a team of fellow mutant rogues to protect a young boy with supernatural abilities from the brutal, time-traveling cyborg Cable."
